Manhard Cold Storage Distribution Center Building 1,"Planned warehouse located at the Turnpike 1 Trade Center. 853,474 SF; cold storage warehouse, supported by 42,714 SF office with supporting; truck maintenance garage building, pallet-processing and maintenance; shed and fuel station.",US-40 & Pointers Auburn Rd,CARNEYS POINT TOWNSHIP,'08098',SALEM,Planning Schematics,Larry Lapinski,3315 N OAK TRFY,Northpoint Development,Manhard Consulting Ltd.,N/A,N/A,N/A,87373105,https://apps.construction.com/projects/202200683045,853474,Warehouse Warehouse (Refrigerated) Water Treatment Plant,N/A,1,7/7/2022,"US-40 & Pointers Auburn Rd, CARNEYS POINT TOWNSHIP, SALEM, NJ '08098'",39.6738408,-75.3967863
Warehouse,Center Square and High Hill roads and adjacent to the highway Route 295,Center Square Rd,LOGAN TOWNSHIP,'08085',GLOUCESTER,Pre-Design,N/A,1902 WASHINGTON AVE STE A,Lovett Industrial,N/A,N/A,N/A,N/A,49999999,https://apps.construction.com/projects/202200749685,309341,Warehouse,N/A,1,9/6/2022,"Center Square Rd, LOGAN TOWNSHIP, GLOUCESTER, NJ '08085'",39.7693811,-75.3708647
Industrial Park Nabisco Plant Redevelopment Master Report,raze several building at former Nabisco site - 39-acre property - Full; scope of work to be determined,NJ-208,FAIR LAWN,'07410',BERGEN,Design Development,N/A,N/A,N/A,N/A,N/A,N/A,N/A,49999999,https://apps.construction.com/projects/202100847471,N/A,Warehouse,N/A,N/A,11/22/2021,"NJ-208, FAIR LAWN, BERGEN, NJ '07410'",40.9372354,-74.1252442
Warehouse & Parking Lot,"Construction of a 644,075 square foot warehouse with office with the; office portion comprising 9,126 square feet and associates parking for; 256 car spaces, 102 loading spaces and 120 trailer spaces",22-11 NJ-208,FAIR LAWN,'07410',BERGEN,Planning Schematics,N/A,N/A,N/A,N/A,"Langan Engineering & Envir. Svcs., Inc.",N/A,N/A,72000000,https://apps.construction.com/projects/202300124745,644075,Warehouse Paving,N/A,1,4/3/2023,"22-11 NJ-208, FAIR LAWN, BERGEN, NJ '07410'",40.94853519999999,-74.1335351
Warehouse and Manufacturing Building Addition - Howell NJ,"141925 sf building addition that will result in a new total building; 231,058 sf - warehouse and manufacturing and will also contain 13769; sf of office space",10 Ruckle Ave,FARMINGDALE,'077273691',MONMOUTH,Construction Documents,N/A,217 COUNTY ROAD 522,Merola Tile,N/A,N/A,N/A,N/A,24999999,https://apps.construction.com/projects/202300094662,141925,Office Warehouse Manufacturing Building,N/A,1,3/14/2023,"10 Ruckle Ave, FARMINGDALE, MONMOUTH, NJ '077273691'",40.2243901,-74.1422458
Warehouse (Lot A),N/A,157 Hamilton Rd,TINTON FALLS,'077249718',MONMOUTH,Planning Schematics,N/A,620 TINTON AVE STE 200,Stavola Realty Company,N/A,N/A,N/A,N/A,14999999,https://apps.construction.com/projects/202100824650,90890,Warehouse,N/A,1,11/1/2021,"157 Hamilton Rd, TINTON FALLS, MONMOUTH, NJ '077249718'",40.2842771,-74.0958129
Crossroads Warehouse A - Phase 1,Construct a warehouse consisting of 671072 SF,1 International Blvd,MAHWAH,'07430',BERGEN,Pre-Design,N/A,20 RIDGE RD STE 210,Crossroads Companies,N/A,N/A,N/A,N/A,1E+15,https://apps.construction.com/projects/202300353489,671072,Warehouse,N/A,1,9/18/2023,"1 International Blvd, MAHWAH, BERGEN, NJ '07430'",41.10459609999999,-74.1608791
Crossroads Warehouse B (Phase 2),Construct a warehouse consisting of 1015752 SF,1 International Blvd,MAHWAH,'07430',BERGEN,Pre-Design,N/A,N/A,N/A,N/A,N/A,N/A,N/A,1E+15,https://apps.construction.com/projects/202300353502,1015752,Warehouse,N/A,1,9/18/2023,"1 International Blvd, MAHWAH, BERGEN, NJ '07430'",41.10459609999999,-74.1608791
Global Courier Express Expansion - Warehouse Fit-Outs,Interior fit outs for on warehouse consisting of 96375 SF and another; consisting of 63902 SF- totaling 160277SF,Basin Drive & Campus Dr,KEARNY,'07032',HUDSON,Construction Documents,N/A,123 5TH AVE,Global Courier Express,N/A,N/A,N/A,N/A,14999999,https://apps.construction.com/projects/202300353439,N/A,Warehouse,N/A,N/A,9/18/2023,"Basin Drive & Campus Dr, KEARNY, HUDSON, NJ '07032'",40.725847,-74.1048294
Meadowlands Park- Flexible Industrial & Office (Shell/Core),"205,000 sq ft warehouse, 1st floor office 12,640 sq ft, 2nd floor; office 13,480 sq ft on 19 acre site",651 12th St,CARLSTADT,'07072',BERGEN,Planning Schematics,N/A,N/A,N/A,N/A,"Russo Development, Inc.",N/A,Douglas Bartels,49999999,https://apps.construction.com/projects/201300410913,231748,Office Warehouse Manufacturing Building Sidewalk/Parking Lot,N/A,1,1/15/2013,"651 12th St, CARLSTADT, BERGEN, NJ '07072'",40.8378749,-74.08156699999999
Peters Brook Innovation Center Warehouses (PH1),"(2) warehouse at 124,978 square feet each",1041 US-202,BRIDGEWATER TOWNSHIP,'08807',SOMERSET,Planning Schematics,Peter Cocoziello Jr,1420 US HIGHWAY 206 STE 200,Advance Realty Investors,N/A,PS&S (Paulus Sokolowski & Sartor LLC),N/A,Lisa DiGerolamo PE,49999999,https://apps.construction.com/projects/202000461008,249978,Warehouse,N/A,2,1/13/2020,"1041 US-202, BRIDGEWATER TOWNSHIP, SOMERSET, NJ '08807'",40.6252958,-74.6309675
Manufacturing - Warehouse and Distribution Facility,Construction of a warehouse and distribution facility and/or; manufacturing and assembly use consisting of 187530 SF with 268; parking spaces and elevated loading docks.,30 Cross St,BOGOTA,'076031515',BERGEN,Planning Schematics,N/A,N/A,N/A,N/A,"Langan Engrg. & Envir. Svcs., Inc.",Phillips Preiss Grygiel Leheny Hughes LLC,Kevin J Webb,24999999,https://apps.construction.com/projects/202100751225,89130,Warehouse Manufacturing Building Freight Terminal,N/A,1,8/26/2021,"30 Cross St, BOGOTA, BERGEN, NJ '076031515'",40.8698092,-74.03456899999999
Manufacturing - Warehouse & Distribution Facility,Construction of a warehouse and distribution facility and/or; manufacturing and assembly,30 Cross St,BOGOTA,'076031515',BERGEN,Planning Schematics,N/A,N/A,N/A,N/A,"Langan Engrg. & Envir. Svcs., Inc.",Phillips Preiss Grygiel Leheny Hughes LLC,Kevin J Webb,14999999,https://apps.construction.com/projects/202000662019,98400,Warehouse Freight Terminal,N/A,1,7/6/2020,"30 Cross St, BOGOTA, BERGEN, NJ '076031515'",40.8698092,-74.03456899999999
McClellan One Logistics Building,"Construction of a high-end logistics building- 10-acre site directly; adjacent to Newark Liberty International Airport. With 90 trailer; stalls and rare freeway frontage, the site is located in the strongest; submarket in all of northern New Jersey with close proximity to the; Port of New York and New Jersey, the New Jersey Turnpike and New York; City.",McClellan St,NEWARK,'07114',ESSEX,Construction Documents,Luke Georgiadis,1200 N 52ND ST,J.P. Morgan Asset Management,N/A,N/A,N/A,N/A,49999999,https://apps.construction.com/projects/202200578662,120000,Warehouse Freight Terminal,N/A,1,4/13/2022,"McClellan St, NEWARK, ESSEX, NJ '07114'",40.687877,-74.1973603
Warehouse Buildings,Construction of 3 warehouse buildings,59 NJ-10,EAST HANOVER,'07981',MORRIS,Planning Schematics,N/A,N/A,N/A,N/A,PS&S (Paulus Sokolowski & Sartor LLC),N/A,N/A,96651579,https://apps.construction.com/projects/202200462701,826800,Warehouse,N/A,3,1/17/2022,"59 NJ-10, EAST HANOVER, MORRIS, NJ '07981'",40.8117374,-74.3921549
Gear Six Auto Parts Warehouses,two buildings measuring 45122 SF and 63492 SF,12 Harts Ln,EAST BRUNSWICK,'088162033',MIDDLESEX,Planning Schematics,N/A,12 HARTS LN,Gear Six Auto Parts,N/A,N/A,N/A,N/A,14999999,https://apps.construction.com/projects/202100868350,108614,Warehouse,N/A,2,12/14/2021,"12 Harts Ln, EAST BRUNSWICK, MIDDLESEX, NJ '088162033'",40.4505221,-74.4083462
Warehouse Addition,"Construction of a 147,610 square foot addition to a 67,124 Square foot; existing warehouse",1437 E State St,HAMILTON TOWNSHIP,'086091713',MERCER,Construction Documents,N/A,N/A,N/A,N/A,N/A,N/A,N/A,24999999,https://apps.construction.com/projects/202200861020,147610,Warehouse,N/A,1,12/14/2022,"1437 E State St, HAMILTON TOWNSHIP, MERCER, NJ '086091713'",40.2296598,-74.7347686
Warehouse 1,N/A,2115 Florence Columbus Rd,BORDENTOWN,'085054219',BURLINGTON,Planning Schematics,Cliff Braunstein,2 COOPER ST,NFI Real Estate,"Traffic Planning and Design, Inc.",N/A,N/A,N/A,89114068,https://apps.construction.com/projects/202200497096,870480,Warehouse,N/A,1,2/14/2022,"2115 Florence Columbus Rd, BORDENTOWN, BURLINGTON, NJ '085054219'",40.0864586,-74.7638711
Warehouse 2,N/A,2115 Florence Columbus Rd,BORDENTOWN,'085054219',BURLINGTON,Planning Schematics,Cliff Braunstein,2 COOPER ST,NFI Real Estate,"Traffic Planning and Design, Inc.",N/A,N/A,N/A,56382195,https://apps.construction.com/projects/202200497105,550750,Warehouse,N/A,1,2/14/2022,"2115 Florence Columbus Rd, BORDENTOWN, BURLINGTON, NJ '085054219'",40.0864586,-74.7638711
Washington Street Self Storage,"construction of two self-storage buildings - The largest building would; be three stories high with 123,259 square feet of self-storage space,; and a drive-through lane on the first floor. The other building would; be one story with 9,907 square feet of storage space and a drive-up; lane",1026 Co Rd 518,SKILLMAN,'085581036',SOMERSET,Planning Schematics,Dino Tomasetti,1590 TROY AVE,Asset Realty & Construction Group,N/A,N/A,N/A,N/A,24999999,https://apps.construction.com/projects/202300343337,133166,Warehouse,N/A,2,9/8/2023,"1026 Co Rd 518, SKILLMAN, SOMERSET, NJ '085581036'",40.4031741,-74.6478032
Sheraton Crossroads - Warehouses,Demolish existing hotel and construct 2 warehouses with 1.7 million SF,1 International Blvd,MAHWAH,'07430',BERGEN,Planning Schematics,N/A,N/A,N/A,"Kimley-Horn and Associates, Inc.",Pronesti Surveying Inc,N/A,N/A,198727243,https://apps.construction.com/projects/202100739045,1700000,Warehouse,N/A,2,8/17/2021,"1 International Blvd, MAHWAH, BERGEN, NJ '07430'",41.10459609999999,-74.1608791
Adler Warehouse,"246 parking spaces, 140 dock spaces and 176 trailer spaces. two tenant; warehouse",1920 River Rd,BURLINGTON,'08016',BURLINGTON,Planning Schematics,N/A,N/A,N/A,N/A,"Taylor, Wiseman & Taylor",N/A,N/A,54000000,https://apps.construction.com/projects/201900869903,523900,Warehouse,N/A,1,10/28/2019,"1920 River Rd, BURLINGTON, BURLINGTON, NJ '08016'",40.1109518,-74.8291097
Adler Warehouse,"demo 3 office buildings on site - construct warehouse with 117,976; square feet of warehouse area and 13,108 square feet of office space.",4001 Hadley Rd,SOUTH PLAINFIELD,'07080',MIDDLESEX,Planning Schematics,N/A,N/A,N/A,N/A,"Casey & Keller, Inc.",N/A,Michael Lanzafama,14999999,https://apps.construction.com/projects/202200755706,121084,Warehouse,N/A,1,9/21/2022,"4001 Hadley Rd, SOUTH PLAINFIELD, MIDDLESEX, NJ '07080'",40.5526093,-74.4249516
Self Storage Facility,2 story self-storage facility,111 Centennial Blvd,VOORHEES TOWNSHIP,'08043',CAMDEN,Sub Bidding Start,Anthony Scavo,2801 SW 31ST AVE STE 2B,Miami City Self Storage,N/A,Tri-State Engineering & Surveying,N/A,Joe Mancini,14999999,https://apps.construction.com/projects/202200737058,125286,Warehouse,N/A,1,8/25/2022,"111 Centennial Blvd, VOORHEES TOWNSHIP, CAMDEN, NJ '08043'",39.8483987,-74.9572136
Warehouse - Addition,"248,500 s.f. of warehouse with 17,000 s.f. office",340 W Commodore Blvd,JACKSON TOWNSHIP,'08527',OCEAN,Planning Schematics,N/A,N/A,N/A,N/A,Professional Design Services LLC,N/A,Ian Borden,49999999,https://apps.construction.com/projects/202200804493,248500,Warehouse,N/A,1,10/25/2022,"340 W Commodore Blvd, JACKSON TOWNSHIP, OCEAN, NJ '08527'",40.153766,-74.372964
"Delilah Road Storage (Egg Harbor Township, NJ)","Construction of new 4-story climate controlled drive-thru self-storage; building totaling approximately 125,000 SF and three 1-story RV/Auto; storage buildings totaling approximately 30,000 SF. Work is to include; approximately 7.5 acres of site work.",N/A,EGG HARBOR TOWNSHIP,'08234',ATLANTIC,Bid Results,Nathan Jameson,1199 LANCASTER AVE,ARX Ventures,N/A,"Duffy, Dolcy, McManus & Roesch",N/A,Thomas C Roesch PE,24999999,https://apps.construction.com/projects/202300055924,155000,Warehouse,N/A,N/A,2/16/2023,"N/A, EGG HARBOR TOWNSHIP, ATLANTIC, NJ '08234'",39.3592271,-74.6891221
Kingsland Meadowlands Phase 1 Buildings A & B,"Building A is 932,168 sq ft (895,148 sq ft warehouse & 37,020 sq ft; office) 142 dock doors, 2 drive in doors, 271 trailer stalls, 527 car; parking spaces - Building B is 344,100 sq ft (323,364 sq ft & 20,746; sq ft office), 65 dock doors, 2 drive in doors, 146 trailer stalls,; 243 car parking spaces - site capping & dynamic compaction",3 NJ-17,RUTHERFORD,'07070',BERGEN,Planning Schematics,N/A,400 HOLLISTER RD,Forsgate Industrial Partners,N/A,N/A,N/A,N/A,149194829,https://apps.construction.com/projects/201900868205,1276278,Office Warehouse Freight Terminal Sidewalk/Parking Lot Site Development,N/A,2,10/28/2019,"3 NJ-17, RUTHERFORD, BERGEN, NJ '07070'",40.8231437,-74.0979922
Flex Warehouse,Construct a warehouse of 149341 SF,2526 Kuser Rd,HAMILTON TOWNSHIP,'086913301',MERCER,Planning Schematics,N/A,116 CHESTNUT ST STE 102,Denholtz Properies,N/A,Dynamic Engineering Consultants LLC,N/A,N/A,24999999,https://apps.construction.com/projects/202300314962,149341,Warehouse,N/A,1,8/28/2023,"2526 Kuser Rd, HAMILTON TOWNSHIP, MERCER, NJ '086913301'",40.2053448,-74.6567941
Puratos Distribution Center,194000 SF fit out,9130 Griffith Morgan Ln,PENNSAUKEN TOWNSHIP,'081103211',CAMDEN,Construction Documents,Dave DuCoin,1660 SUCKLE HWY,Puratos Corporation US Headquarters,N/A,N/A,N/A,N/A,14999999,https://apps.construction.com/projects/202300326107,N/A,Warehouse,N/A,N/A,8/25/2023,"9130 Griffith Morgan Ln, PENNSAUKEN TOWNSHIP, CAMDEN, NJ '081103211'",39.992107,-75.04415089999999
Warehouse Parcel B,"new 136,240 Sf Single-story Warehouse located on 550 Halls Mill Road; and 558 Halls Mill Road Freehold, NJ",550 Halls Mill Rd,FREEHOLD,'07728',MONMOUTH,Bid Results,N/A,558 HALLS MILL RD,BH 550-558 HALLS MILL HOLDER LLC,N/A,N/A,N/A,N/A,14999999,https://apps.construction.com/projects/202000455937,136240,Warehouse,N/A,1,1/8/2020,"550 Halls Mill Rd, FREEHOLD, MONMOUTH, NJ '07728'",40.23188500000001,-74.250243
Warehouse Development (Phase 1),N/A,Admiral Wilson Blvd & 19th St,CAMDEN,'08105',CAMDEN,Construction Documents,N/A,3 CENTRE DR,Matrix Development Group,Langan Engineering & Environmental Services Inc,N/A,N/A,N/A,49999999,https://apps.construction.com/projects/202000797140,279600,Warehouse,N/A,1,12/2/2020,"Admiral Wilson Blvd & 19th St, CAMDEN, CAMDEN, NJ '08105'",39.9401755,-75.0957813
Warehouse Development (Phase 2),N/A,Admiral Wilson Blvd & 19th St,CAMDEN,'08105',CAMDEN,Planning Schematics,N/A,3 CENTRE DR,Matrix Development Group,Langan Engineering & Environmental Services Inc,N/A,N/A,N/A,14999999,https://apps.construction.com/projects/202200850214,132000,Warehouse,N/A,1,12/5/2022,"Admiral Wilson Blvd & 19th St, CAMDEN, CAMDEN, NJ '08105'",39.9401755,-75.0957813
Kingsland Meadowlands Phase 2 Building C,Phase 2 is Bldg C - 210 loading docks - 4 drive in doors - 493 trailer; parking spaces - 704 car spaces,"off Route 3 & 17, in Rutherford",LYNDHURST,'07071',BERGEN,Planning Schematics,N/A,400 HOLLISTER RD,Forsgate Industrial Partners,N/A,N/A,N/A,N/A,138342217,https://apps.construction.com/projects/202300204113,1183440,Office Warehouse Freight Terminal Sidewalk/Parking Lot Site Development,N/A,2,5/23/2023,"off Route 3 & 17, in Rutherford, LYNDHURST, BERGEN, NJ '07071'",40.8231437,-74.0979922
Warehouse Building D,Construct a warehouse consisting of 266890 SF,1062 US-322,WOOLWICH TOWNSHIP,'08085',GLOUCESTER,Planning Schematics,N/A,N/A,N/A,N/A,Consulting Engineer Services,N/A,N/A,49999999,https://apps.construction.com/projects/202100615196,266890,Warehouse,N/A,1,5/11/2021,"1062 US-322, WOOLWICH TOWNSHIP, GLOUCESTER, NJ '08085'",39.754306,-75.272134
Enterprise Drive - Warehouse Building C,Construct a warehouse consisting of 312317 SF,1062 US-322,HARRISON TOWNSHIP,'08062',GLOUCESTER,Design Development,N/A,N/A,N/A,N/A,Consulting Engineer Services,N/A,N/A,49999999,https://apps.construction.com/projects/202100615195,312317,Warehouse,N/A,1,5/11/2021,"1062 US-322, HARRISON TOWNSHIP, GLOUCESTER, NJ '08062'",39.754306,-75.272134
Warehouse Building A,Construct a warehouse consisting of 963316 SF,1062 US-322,HARRISON TOWNSHIP,'08062',GLOUCESTER,Planning Schematics,N/A,N/A,N/A,N/A,N/A,Consulting Engineer Services,N/A,98618013,https://apps.construction.com/projects/202100615187,963316,Warehouse,N/A,1,5/11/2021,"1062 US-322, HARRISON TOWNSHIP, GLOUCESTER, NJ '08062'",39.754306,-75.272134
Warehouse Building B,Construct a warehouse consisting of 639578 SF,1062 US-322,WOOLWICH TOWNSHIP,'08085',GLOUCESTER,Planning Schematics,N/A,N/A,N/A,N/A,N/A,Consulting Engineer Services,N/A,65475827,https://apps.construction.com/projects/202100615194,639578,Warehouse,N/A,1,5/11/2021,"1062 US-322, WOOLWICH TOWNSHIP, GLOUCESTER, NJ '08085'",39.754306,-75.272134
Self-Storage Facility,Construct a 3-story self-storage building,372 US-46,MOUNTAIN LAKES,'070461740',MORRIS,Planning Schematics,N/A,280 STATE ROUTE 35 STE 150,Highview Homes LLC/Highview Commercial LLC,N/A,Dynamic Engineering Consultants LLC,N/A,Matthew Sharo PE,14999999,https://apps.construction.com/projects/202200813078,98268,Warehouse,N/A,1,11/1/2022,"372 US-46, MOUNTAIN LAKES, MORRIS, NJ '070461740'",40.8852809,-74.4636908
400 Atrium Drive Warehouse A,Construct a warehouse consisting of 255111 SF,400 Atrium Dr,FRANKLIN TOWNSHIP,'088734162',SOMERSET,Planning Schematics,N/A,N/A,N/A,N/A,N/A,N/A,N/A,49999999,https://apps.construction.com/projects/202300165738,255111,Warehouse,N/A,1,5/2/2023,"400 Atrium Dr, FRANKLIN TOWNSHIP, SOMERSET, NJ '088734162'",40.5341951,-74.51855429999999
Retail and Self-Storage Space,N/A,1069 NJ-18,EAST BRUNSWICK,'088164351',MIDDLESEX,Planning Schematics,Keissler Wong,1069 STATE ROUTE 18,Rock Solid Realty,N/A,Dynamic Engineering Consultants LLC,N/A,N/A,14999999,https://apps.construction.com/projects/202200528049,86660,Retail (Other) Warehouse,N/A,1,3/8/2022,"1069 NJ-18, EAST BRUNSWICK, MIDDLESEX, NJ '088164351'",40.4188281,-74.37526410000001
Warehouse,Gaitway Farm Redevelopment - Phase 1,Woodward Rd,MANALAPAN TOWNSHIP,'07726',MONMOUTH,Pre-Design,N/A,5 TENAFLY RD STE 416,Active Acquisitions,N/A,N/A,N/A,N/A,14999999,https://apps.construction.com/projects/202300315202,N/A,Warehouse,N/A,1,8/17/2023,"Woodward Rd, MANALAPAN TOWNSHIP, MONMOUTH, NJ '07726'",40.2620416,-74.3617397
Warehouse,Construct a warehouse consisting of 81685 SF and an office -2 story of; 5225 SF,Atrium Dr,FRANKLIN TOWNSHIP,'08873',SOMERSET,Planning Schematics,N/A,3614 KENNEDY RD,Puleo International Inc,N/A,Stires Associates,N/A,N/A,14999999,https://apps.construction.com/projects/202300032549,86910,Office Warehouse,N/A,1,2/5/2023,"Atrium Dr, FRANKLIN TOWNSHIP, SOMERSET, NJ '08873'",40.533765,-74.5208199
Warehouse,"220,495 square feet of warehouse space, 4,400 square feet of office; space, 2,675 square feet of office space for contractors, 2,675 square; feet of office space for wholesale trade and 2,675 square feet for; manufacturing goods.",51 NJ-33,MANALAPAN TOWNSHIP,'077268354',MONMOUTH,Planning Schematics,John Kainer,16 LEHIGH DR,"ARP American Realty Partners, LLC",N/A,Colliers Engineering and Design,N/A,N/A,49999999,https://apps.construction.com/projects/202200518193,220495,Warehouse,N/A,1,3/1/2022,"51 NJ-33, MANALAPAN TOWNSHIP, MONMOUTH, NJ '077268354'",40.2543864,-74.327164
Manalapan Logistics Center Warehouse 2 (Bldg B),13000 SF of office space,203 NJ-33,MANALAPAN TOWNSHIP,'077268304',MONMOUTH,Planning Schematics,Terry Sherman,76 STILLWELL RD,Countryside Developers,N/A,Colliers Engineering and Design,N/A,Julia Algeo,49999999,https://apps.construction.com/projects/201900746410,302250,Office Warehouse,N/A,1,7/12/2019,"203 NJ-33, MANALAPAN TOWNSHIP, MONMOUTH, NJ '077268304'",40.2528412,-74.3542382
Manalapan Logistics Center Warehouse 1 (Bldg A),13000 SF of office space,203 NJ-33,MANALAPAN TOWNSHIP,'077268304',MONMOUTH,Planning Schematics,Terry Sherman,76 STILLWELL RD,Countryside Developers,N/A,Colliers Engineering and Design,N/A,Julia Algeo,49999999,https://apps.construction.com/projects/201900746378,294560,Office Warehouse,N/A,1,7/12/2019,"203 NJ-33, MANALAPAN TOWNSHIP, MONMOUTH, NJ '077268304'",40.2528412,-74.3542382
Howell 2 - Warehouse A,"remove the existing 1-story dwelling and develop the property by; constructing two (2) 1-story warehouse buildings with office space.; Warehouse A totals 369,242 s.f. in size, consisting of 349,242 s.f. of; warehouse and 20,000 s.f. of office space. Warehouse A will also have; 54 loading bays, 2 drive-in bays, 209 vehicle parking spaces (9 of; which are electric vehicle charging stations) and 35 tractor trailer; parking spaces.",375 Fairfield Rd,HOWELL TOWNSHIP,'07728',MONMOUTH,Planning Schematics,Seth Gerszberg,5 TENAFLY RD STE 416,Active Acquisitions,N/A,Bohler Engineering,N/A,Tungto Lam,49999999,https://apps.construction.com/projects/202200676394,369242,Office Warehouse,N/A,1,7/5/2022,"375 Fairfield Rd, HOWELL TOWNSHIP, MONMOUTH, NJ '07728'",40.2262718,-74.2204047
Howell 2 - Warehouse B,"Warehouse B totals 134,714 s.f. in size, consisting of 124,714 s.f. of; warehouse space and 10,000 s.f. of office space. Warehouse B will also; have 36 loading bays, 2 drive-in bays, 77 vehicle parking space (2 of; which are electric vehicle charging stations) and does not provide; additional tractor trailing parking. Additional site improvements; consist of lighting, landscaping, and stormwater management systems",375 Fairfield Rd,HOWELL TOWNSHIP,'07728',MONMOUTH,Planning Schematics,Seth Gerszberg,5 TENAFLY RD STE 416,Active Acquisitions,N/A,Bohler Engineering,N/A,Tungto Lam,14999999,https://apps.construction.com/projects/202200676400,124714,Office Warehouse,N/A,1,7/5/2022,"375 Fairfield Rd, HOWELL TOWNSHIP, MONMOUTH, NJ '07728'",40.2262718,-74.2204047
Warehouse 9,N/A,1875 NJ-34,WALL TOWNSHIP,'07719',MONMOUTH,Planning Schematics,Seth Gerszberg,5 TENAFLY RD STE 416,Active Acquisitions,N/A,Colliers Engineering,N/A,Patrick Lynam,60000000,https://apps.construction.com/projects/202200533428,598723,Warehouse,N/A,1,3/11/2022,"1875 NJ-34, WALL TOWNSHIP, MONMOUTH, NJ '07719'",40.1785411,-74.12134069999999
Warehouse 8,N/A,1875 NJ-34,WALL TOWNSHIP,'07719',MONMOUTH,Planning Schematics,Seth Gerszberg,5 TENAFLY RD STE 416,Active Acquisitions,N/A,Colliers Engineering,N/A,Patrick Lynam,46000000,https://apps.construction.com/projects/202200533424,457071,Warehouse,N/A,1,3/11/2022,"1875 NJ-34, WALL TOWNSHIP, MONMOUTH, NJ '07719'",40.1785411,-74.12134069999999
Warehouse 7,N/A,1875 NJ-34,WALL TOWNSHIP,'07719',MONMOUTH,Planning Schematics,Seth Gerszberg,5 TENAFLY RD STE 416,Active Acquisitions,N/A,Colliers Engineering,N/A,Patrick Lynam,24999999,https://apps.construction.com/projects/202200533420,211962,Warehouse,N/A,1,3/11/2022,"1875 NJ-34, WALL TOWNSHIP, MONMOUTH, NJ '07719'",40.1785411,-74.12134069999999
Warehouse 6,N/A,1875 NJ-34,WALL TOWNSHIP,'07719',MONMOUTH,Planning Schematics,Seth Gerszberg,5 TENAFLY RD STE 416,Active Acquisitions,N/A,Colliers Engineering,N/A,Patrick Lynam,24999999,https://apps.construction.com/projects/202200533413,211962,Warehouse,N/A,1,3/11/2022,"1875 NJ-34, WALL TOWNSHIP, MONMOUTH, NJ '07719'",40.1785411,-74.12134069999999
Warehouse 5,N/A,1875 NJ-34,WALL TOWNSHIP,'07719',MONMOUTH,Planning Schematics,Seth Gerszberg,5 TENAFLY RD STE 416,Active Acquisitions,N/A,Colliers Engineering,N/A,Patrick Lynam,14999999,https://apps.construction.com/projects/202200533411,139746,Warehouse,N/A,1,3/11/2022,"1875 NJ-34, WALL TOWNSHIP, MONMOUTH, NJ '07719'",40.1785411,-74.12134069999999
Warehouse 4,N/A,1875 NJ-34,WALL TOWNSHIP,'07719',MONMOUTH,Planning Schematics,Seth Gerszberg,5 TENAFLY RD STE 416,Active Acquisitions,N/A,Colliers Engineering,N/A,Patrick Lynam,14999999,https://apps.construction.com/projects/202200533403,139746,Warehouse,N/A,1,3/11/2022,"1875 NJ-34, WALL TOWNSHIP, MONMOUTH, NJ '07719'",40.1785411,-74.12134069999999
Warehouse 3,N/A,1875 NJ-34,WALL TOWNSHIP,'07719',MONMOUTH,Planning Schematics,Seth Gerszberg,5 TENAFLY RD STE 416,Active Acquisitions,N/A,Colliers Engineering,N/A,Patrick Lynam,14999999,https://apps.construction.com/projects/202200533398,N/A,Warehouse,N/A,N/A,3/11/2022,"1875 NJ-34, WALL TOWNSHIP, MONMOUTH, NJ '07719'",40.1785411,-74.12134069999999
Warehouse 2,N/A,1875 NJ-34,WALL TOWNSHIP,'07719',MONMOUTH,Planning Schematics,Seth Gerszberg,5 TENAFLY RD STE 416,Active Acquisitions,N/A,Colliers Engineering,N/A,Patrick Lynam,14999999,https://apps.construction.com/projects/202200533393,139746,Warehouse,N/A,1,3/11/2022,"1875 NJ-34, WALL TOWNSHIP, MONMOUTH, NJ '07719'",40.1785411,-74.12134069999999
Warehouse 1,N/A,1875 NJ-34,WALL TOWNSHIP,'07719',MONMOUTH,Planning Schematics,Seth Gerszberg,5 TENAFLY RD STE 416,Active Acquisitions,N/A,Colliers Engineering,N/A,Patrick Lynam,14999999,https://apps.construction.com/projects/202200533382,139746,Warehouse,N/A,1,3/11/2022,"1875 NJ-34, WALL TOWNSHIP, MONMOUTH, NJ '07719'",40.1785411,-74.12134069999999
Warehouse,Construction a new warehouse,861 Sloan Ave,HAMILTON TOWNSHIP,'086192102',MERCER,Design Development,Steve Collins,1650 DES PERES RD STE 300,Commercial Development Co Inc,N/A,"Langan Engineering & Envir. Svcs., Inc.",N/A,Bryan M Waisnor,49999999,https://apps.construction.com/projects/202100765385,420024,Warehouse,N/A,1,9/9/2021,"861 Sloan Ave, HAMILTON TOWNSHIP, MERCER, NJ '086192102'",40.2507663,-74.70371089999999
Warehouse & Office Building,"Construct a 45 single story warehouse facility consisting of; approximately 325,000 SF, containing approximately 313,000 sf of; warehouse space and 12,000 sf of office space.",399 Princeton Hightstown Rd,EAST WINDSOR,'08512',MERCER,Design Development,N/A,250 VESEY ST FL 15,Brookfield Asset Management Inc.,N/A,Dynamic Engineering Consultants PC,John McDonough Associates LLC,Brett Skapinetz,49999999,https://apps.construction.com/projects/202200735733,325000,Office Warehouse,N/A,1,8/24/2022,"399 Princeton Hightstown Rd, EAST WINDSOR, MERCER, NJ '08512'",40.29224,-74.574298
